<?xml version="1.0" encoding="UTF-8"?>

 <!DOCTYPE arg SYSTEM "newXMLDocument1.dtd">

<!--
To change this license header, choose License Headers in Project Properties.
To change this template file, choose Tools | Templates
and open the template in the editor.
-->
<arg>
    <tipo>titulo</tipo>
    <jijo>
        
        <al s="2">hola</al>
        <KI>51</KI>
        <al s="1 45">adios</al>
        <KI>2</KI>
         <KI>56</KI>
    </jijo>
    
</arg>
